nome_organizacao,descricao_organizacao,segmento_atuacao,tecnologias_disruptivas
Alldone Car Service,"A Alldone Car Service é uma empresa de intermediação de serviços automotivos que simplifica a vida de proprietários de veículos que não tem tempo ou não querem levar o carro a uma oficina, proporcionando a estes uma experiência de usuário única. 
Os Analistas de Manutenção Automotiva da Alldone entendem de mecânica, buscam o carro no local de conveniência do proprietário e resolvem QUALQUER questão, levando o carro em oficinas especializadas e entregando no local onde o proprietário indicar.","Automóveis, Mobilidade",Nenhuma
Long Stay Suites,"A Booking para mensalistas em Hoteis, Aoart Hoteis e Flats",Turismo,Nenhuma
AVULTA CONTRATAÇÃO PROFISSIONAL INCLUSIVA,"A Avulta é uma plataforma que conecta pessoas com diversidade funcional a empresas que precisam contratar pela lei de cotas. Fazemos o match profissional por meio da Avaliação Neurocognitiva Avulta (ANA). Uma metodologia inovadora que ressalta o potencial laboral do candidato em um produto denominado Avulta Perfil. O objetivo é destacar perfis profissionais de pessoas com diversidade funcional, baseados em neurocognição, com o intuito de incluir esses profissionais de forma assertiva e não apenas cumprir cotas.","Recursos Humanos, Negócios sociais",Nenhuma
Conveniar,"A Conveniar é especializada em desenvolver a gestão das fundações de apoio a universidades e instituições de pesquisa.
É a empresa líder do setor com a solução implantada em mais de 35% do mercado de fundações de apoio.",Gestão de negócios,Big Data
